{
  "$schema": "https://json-schema.org/draft/2020-12/schema",
  "$id": "https://github.com/thomazique/init-harness/blob/main/.init-harness/schema/config.schema.json",
  "title": "init-harness project configuration",
  "type": "object",
  "additionalProperties": false,
  "required": [
    "harness_version",
    "modo",
    "instalado_em",
    "providers",
    "grafo",
    "memoria",
    "jev",
    "bootstrap",
    "frente_inativa_horas",
    "autonomia",
    "orquestracao",
    "ambientes"
  ],
  "properties": {
    "$schema": {"type": "string"},
    "harness_version": {"type": "string", "pattern": "^[0-9]+\\.[0-9]+\\.[0-9]+$"},
    "modo": {"enum": ["proprio", "cliente"]},
    "instalado_em": {"type": "string", "format": "date"},
    "providers": {
      "type": "array",
      "minItems": 1,
      "uniqueItems": true,
      "items": {"enum": ["claude", "codex"]}
    },
    "grafo": {"enum": ["graphify", "manual"]},
    "memoria": {
      "type": "object",
      "additionalProperties": false,
      "required": ["mcp"],
      "properties": {"mcp": {"type": "boolean"}}
    },
    "jev": {
      "type": "object",
      "additionalProperties": false,
      "required": ["enabled"],
      "properties": {"enabled": {"type": "boolean"}}
    },
    "bootstrap": {
      "type": "object",
      "additionalProperties": false,
      "required": ["opt_in"],
      "properties": {"opt_in": {"type": "boolean"}}
    },
    "frente_inativa_horas": {
      "oneOf": [
        {"type": "null"},
        {"type": "number", "minimum": 0}
      ]
    },
    "autonomia": {
      "type": "object",
      "additionalProperties": false,
      "required": ["tarefas_seguras", "apos_checkpoint", "producao", "destrutivo", "politica_negocio"],
      "properties": {
        "tarefas_seguras": {"enum": ["continuar", "parar"]},
        "apos_checkpoint": {"enum": ["continuar", "parar"]},
        "producao": {"enum": ["confirmar", "bloquear"]},
        "destrutivo": {"enum": ["confirmar", "bloquear"]},
        "politica_negocio": {"enum": ["confirmar", "bloquear"]}
      }
    },
    "guardrails": {
      "type": "object",
      "additionalProperties": false,
      "properties": {
        "bash_extras": {
          "type": "array",
          "items": {"type": "string"},
          "description": "Regex adicionais que pedem confirmação no guard_bash; nunca removem uma regra do kit."
        },
        "gates": {
          "type": "object",
          "additionalProperties": false,
          "properties": {
            "caminhos_teste": {"type": "array", "items": {"type": "string"}},
            "caminhos_snapshot": {"type": "array", "items": {"type": "string"}}
          }
        }
      }
    },
    "orquestracao": {
      "type": "object",
      "additionalProperties": false,
      "required": ["limite_executores", "paralelizar_tarefas_independentes", "auditoria_uma_vez_por_atividade"],
      "properties": {
        "limite_executores": {"type": "integer", "minimum": 1},
        "paralelizar_tarefas_independentes": {"type": "boolean"},
        "auditoria_uma_vez_por_atividade": {"type": "boolean"}
      }
    },
    "ambientes": {
      "type": "object",
      "additionalProperties": false,
      "required": ["se_indeterminado", "regras"],
      "properties": {
        "se_indeterminado": {"enum": ["permitir", "confirmar", "bloquear"]},
        "regras": {
          "type": "array",
          "items": {
            "type": "object",
            "additionalProperties": false,
            "required": ["nome", "arquivo", "chave", "valores", "destrutivo"],
            "properties": {
              "nome": {"type": "string", "minLength": 1},
              "arquivo": {"type": "string", "minLength": 1},
              "chave": {"type": "string", "minLength": 1},
              "valores": {
                "type": "array",
                "minItems": 1,
                "items": {"type": "string"}
              },
              "destrutivo": {"enum": ["permitir", "confirmar", "bloquear"]}
            }
          }
        }
      }
    }
  }
}
