{
  "$schema": "./schema/config.schema.json",
  "harness_version": "5.1.3",
  "modo": "proprio",
  "instalado_em": "AAAA-MM-DD",
  "providers": ["claude", "codex"],
  "grafo": "graphify",
  "memoria": {"mcp": false},
  "jev": {"enabled": false},
  "bootstrap": {"opt_in": false},
  "frente_inativa_horas": null,
  "autonomia": {
    "tarefas_seguras": "continuar",
    "apos_checkpoint": "continuar",
    "producao": "confirmar",
    "destrutivo": "confirmar",
    "politica_negocio": "bloquear"
  },
  "orquestracao": {
    "limite_executores": 3,
    "paralelizar_tarefas_independentes": true,
    "auditoria_uma_vez_por_atividade": true
  },
  "ambientes": {
    "se_indeterminado": "bloquear",
    "regras": []
  }
}
